{
  "run_id": "001-xhs-ai-agent-save-one-hour",
  "scenario_id": "xiaohongshu-creator",
  "action_type": "content_platform_publish_handoff",
  "requested_mode": "human_review_then_draft",
  "approved_mode": "human_review_then_draft",
  "allowed_action": "save_draft_only",
  "target_artifact": "runs/001-xhs-ai-agent-save-one-hour/generated-note.md",
  "verification_level": "failed_with_evidence",
  "fact_status": "fact_verified",
  "compliance_status": "failed",
  "promotion_status": "not_promotable",
  "action_started_at": "2026-05-25T00:59:12.997Z",
  "action_finished_at": "2026-05-25T09:00:07+08:00",
  "gate_order": [
    "human_review",
    "risk_approval",
    "state_precheck",
    "mode_approval",
    "action_handoff",
    "action_execution",
    "proof_verification",
    "promotion_approval"
  ],
  "gates": {
    "human_review": {
      "status": "failed",
      "checked_at": "2026-05-25T11:38:28+08:00",
      "evidence_ref": "runs/001-xhs-ai-agent-save-one-hour/human-review.md",
      "notes": "No valid pre-publish human approval exists."
    },
    "risk_approval": {
      "status": "failed",
      "checked_at": "2026-05-25T11:38:28+08:00",
      "evidence_ref": "runs/001-xhs-ai-agent-save-one-hour/human-review.md",
      "notes": "Risk approval before action was not proven."
    },
    "state_precheck": {
      "status": "failed",
      "checked_at": "2026-05-25T11:38:28+08:00",
      "evidence_ref": "runs/001-xhs-ai-agent-save-one-hour/human-review.md",
      "notes": "Independent account-state pass before handoff was not proven."
    },
    "mode_approval": {
      "status": "failed",
      "checked_at": "2026-05-25T11:38:28+08:00",
      "evidence_ref": "runs/001-xhs-ai-agent-save-one-hour/human-review.md",
      "notes": "The run attempted publish without approved mode escalation from draft."
    },
    "action_handoff": {
      "status": "failed",
      "checked_at": "2026-05-25T09:00:07+08:00",
      "evidence_ref": "runs/001-xhs-ai-agent-save-one-hour/publish-proof.md",
      "notes": "A platform handoff occurred without a complete preceding gate chain."
    },
    "action_execution": {
      "status": "passed",
      "checked_at": "2026-05-25T09:00:07+08:00",
      "evidence_ref": "runs/001-xhs-ai-agent-save-one-hour/publish-proof.md",
      "notes": "A published post fact was observed and verified."
    },
    "proof_verification": {
      "status": "failed",
      "checked_at": "2026-05-25T11:38:28+08:00",
      "evidence_ref": "runs/001-xhs-ai-agent-save-one-hour/publish-proof.md",
      "notes": "The publish fact exists, but compliant proof failed."
    },
    "promotion_approval": {
      "status": "failed",
      "checked_at": "2026-05-25T11:38:28+08:00",
      "evidence_ref": "failed-recipes/xhs-ai-agent-save-one-hour.recipe.md",
      "notes": "This run is failure evidence only and must not be promoted."
    }
  },
  "evidence_refs": [
    "runs/001-xhs-ai-agent-save-one-hour/gate-ledger.json",
    "runs/001-xhs-ai-agent-save-one-hour/publish-proof.md",
    "failed-recipes/xhs-ai-agent-save-one-hour.recipe.md"
  ],
  "notes": "The platform action fact is useful evidence, but the run does not satisfy compliance verification."
}
